<?xml version="1.0"?>
<!DOCTYPE config SYSTEM "../MPC_Config/extra/config-meta.dtd">
<config>
	<usertypes>
		<struct name="launcher" doc="Options for MPC launcher.">
			<param name="verbosity" type="int" default="0" doc="Default verbosity level from 0 to 3. Can be override by -vv on mpcrun." alias="LN_VERBOSITY" />
			<param name="banner" type="bool" default="true" doc="Display the MPC banner at launch time to print some informations about the topology. Can be override by MPC_DISABLE_BANNER." alias="LN_BANNER" />
			<param name="autokill" type="int" default="0" doc="Automatically kill the MPC processes after a given timeout. Use 0 to disable. Can be override by MPC_AUTO_KILL_TIMEOUT." alias="LN_AUTOKILL" />
			<param name="user_launchers" type="string" default="default" doc="Permit to extend the launchers available via 'mpcrun -l=...' by providing scripts (named mpcrun_XXXX) in a user directory. Can be override by MPC_USER_LAUNCHERS."/>
			<param name="keep_rand_addr" type="bool" default="true" doc="Activate randomization of base addresses" />
			<param name="disable_rand_addr" type="bool" default="false" doc="Deactivate randomization of base addresses" alias="LN_ADDR_RAND_DISABLE" />
			<param name="disable_mpc" type="bool" default="false" doc="Do not use mpc for execution (deprecated?)" alias="LN_DISABLE_MPC"/>
            <param name="thread_init" type="funcptr" doc="Initialize multithreading mode" default="sctk_use_ethread_mxn" />
			<param name="nb_task" type="int" default="1" doc="Define the number of MPI tasks" alias="LN_MPI_TASK" />
			<param name="nb_process" type="int" default="1" doc="Define the number of MPC processes" alias="LN_MPC_PROCESS" />
			<param name="nb_processor" type="int" default="0" doc="Define the number of virtual processors" alias="LN_MPC_VP" />
			<param name="nb_node" type="int" default="1" doc="Define the number of compute nodes" alias="LN_MPC_NODE" />
			<param name="launcher" type="string" default="none" doc="Define which launcher to use" />
			<param name="max_try" type="int" default="10" doc="Define the max number of tries to access the topology file before failing" alias="LN_MAX_TOPO_TRY" />
			<param name="profiling" type="string" default="stdout" doc="Select the type of outputs for the profiling" />
			<param name="enable_smt" type="bool" default="false" doc="Enable usage of hyperthreaded cores if available on current architecture." alias="LN_ENABLE_SMT" />
			<param name="share_node" type="bool" default="false" doc="Enable the restriction on CPU number to share node" alias="LN_SHARE_NODE" />
			<param name="restart" type="bool" default="false" doc="Restart MPC from a previous checkpoint" alias="LN_RESTART" />
			<param name="checkpoint" type="bool" default="false" doc="Enable MPC checkpointing" alias="LN_CHECKPOINT" />
			<param name="report" type="bool" default="false" doc="Enable reporting." alias="LN_REPORT" />
		</struct>
	</usertypes>
	<modules>
		<module name="launcher" type="launcher"/>
	</modules>
</config>
