<?xml version="1.0"?>
<!DOCTYPE config SYSTEM "../MPC_Config/extra/config-meta.dtd">
<config>
	<usertypes>
		<struct name="debugger" doc="Options for MPC Debugger">
			<param name="colors" type="bool" default="true" doc="Print colored text in terminal"/>
			<param name="max_filename_size" type="int" default="1024" doc=""/>
			<param name="mpc_bt_sig" type="int" default="1" doc="Should MPC capture common signals also connected to the MPC_BT_SIG environment variable which supersedes the config" />
		</struct>
	</usertypes>
	<modules>
		<module name="debugger" type="debugger"/>
	</modules>
</config>
